{
  "id": "USA-008-RAMIREZ",
  "schema_version": "0.1.0",
  "record_status": "in_progress",
  "provenance": {
    "created": "2026-09-06",
    "last_reviewed": "2026-09-06",
    "contributors": [
      "maintainer"
    ],
    "ai_assisted": true
  },
  "identity": {
    "legal_name": {
      "value": "Richard Ramirez",
      "confidence": "established",
      "sources": [
        {
          "tier": 1,
          "citation": "People v. Ramirez, 39 Cal. 4th 398, 139 P.3d 64 (Cal. 2006)",
          "url": "https://caselaw.findlaw.com/court/ca-supreme-court/1098993.html"
        },
        {
          "tier": 4,
          "citation": "NPR. \"'Night Stalker' Richard Ramirez Dies In Prison.\" 7 June 2013.",
          "url": "https://www.npr.org/sections/thetwo-way/2013/06/07/189531588/night-stalker-richard-ramirez-dies-in-prison"
        }
      ],
      "notes": "The fuller form Ricardo Leyva Muñoz Ramírez circulates widely. The appellate opinion uses 'Richard Ramirez'; the longer form has not been confirmed against a record and is not asserted."
    },
    "aliases": {
      "value": null,
      "confidence": "unverified",
      "sources": [],
      "search_exhausted": true,
      "notes": "No documented aliases located in the appellate record."
    },
    "media_epithet": {
      "value": "Night Stalker",
      "confidence": "established",
      "sources": [
        {
          "tier": 1,
          "citation": "People v. Ramirez, 39 Cal. 4th 398, 139 P.3d 64 (Cal. 2006)",
          "url": "https://caselaw.findlaw.com/court/ca-supreme-court/1098993.html"
        },
        {
          "tier": 4,
          "citation": "NPR. \"'Night Stalker' Richard Ramirez Dies In Prison.\" 7 June 2013.",
          "url": "https://www.npr.org/sections/thetwo-way/2013/06/07/189531588/night-stalker-richard-ramirez-dies-in-prison"
        }
      ],
      "notes": "Press epithet assigned during the offending period. Analytically consequential here in a way it is nowhere else in the dataset: the coverage that attached this label is the same coverage that published his photograph, which is what led directly to his capture. Note the collision with USA-004-DEANGELO, who also carried 'Original Night Stalker' — evidence that press epithets are not identifiers and must never be used as keys."
    },
    "birth_date": {
      "value": null,
      "confidence": "unverified",
      "sources": [],
      "search_exhausted": false,
      "notes": "Commonly given as 29 February 1960, and a leap-day birth is the kind of detail that would be trivial to confirm from a Texas birth record or the trial file. Neither has been retrieved, and every accessible secondary source located was a wiki or aggregator. The contemporaneous death report gives his age as 53 on 7 June 2013, which constrains the birth to between June 1959 and June 1960 — consistent with, but not proof of, the circulating date. [SEARCH NOT EXHAUSTED — a research todo, not a finding.]"
    },
    "birth_place": {
      "value": null,
      "confidence": "unverified",
      "sources": [],
      "search_exhausted": false,
      "notes": "Commonly given as El Paso, Texas. No record retrieved. [SEARCH NOT EXHAUSTED — a research todo, not a finding.]"
    },
    "death_date": {
      "value": "2013-06-07",
      "confidence": "established",
      "sources": [
        {
          "tier": 1,
          "citation": "Marin County Coroner, findings on the death of Richard Ramirez, 2013",
          "url": "https://cbsnews.com/sanfrancisco/news/marin-coroner-says-night-stalker-died-from-lymphoma-hepatitis-c"
        },
        {
          "tier": 4,
          "citation": "NPR. \"'Night Stalker' Richard Ramirez Dies In Prison.\" 7 June 2013.",
          "url": "https://www.npr.org/sections/thetwo-way/2013/06/07/189531588/night-stalker-richard-ramirez-dies-in-prison"
        }
      ],
      "notes": "Died at Marin General Hospital, aged 53, while under sentence of death at San Quentin. The Marin County Coroner determined the cause as complications of B-cell lymphoma, with chronic substance abuse and hepatitis C viral infection as contributing conditions."
    },
    "judicial_status": {
      "value": "Deceased. Convicted of 13 counts of murder and numerous sexual and burglary offences; sentenced to death and died in custody before execution.",
      "confidence": "established",
      "sources": [
        {
          "tier": 1,
          "citation": "People v. Ramirez, 39 Cal. 4th 398, 139 P.3d 64 (Cal. 2006)",
          "url": "https://caselaw.findlaw.com/court/ca-supreme-court/1098993.html"
        },
        {
          "tier": 1,
          "citation": "Marin County Coroner, findings on the death of Richard Ramirez, 2013",
          "url": "https://cbsnews.com/sanfrancisco/news/marin-coroner-says-night-stalker-died-from-lymphoma-hepatitis-c"
        }
      ]
    }
  },
  "conviction_record": {
    "convictions": {
      "value": [
        {
          "charge": "12 counts of first-degree murder and one count of second-degree murder, with multiple-murder, burglary, rape, forcible sodomy and forcible oral copulation special circumstances",
          "jurisdiction": "Superior Court, Los Angeles County, California",
          "date": "1989-09-20",
          "disposition": "Jury verdicts accepted; death sentence imposed 7 November 1989"
        },
        {
          "charge": "Five counts of attempted murder; four counts of rape; three counts of forcible oral copulation; four counts of forcible sodomy; 14 counts of first-degree burglary",
          "jurisdiction": "Superior Court, Los Angeles County, California",
          "date": "1989-09-20",
          "disposition": "Guilty"
        }
      ],
      "confidence": "established",
      "sources": [
        {
          "tier": 1,
          "citation": "People v. Ramirez, 39 Cal. 4th 398, 139 P.3d 64 (Cal. 2006)",
          "url": "https://caselaw.findlaw.com/court/ca-supreme-court/1098993.html"
        },
        {
          "tier": 4,
          "citation": "NPR. \"'Night Stalker' Richard Ramirez Dies In Prison.\" 7 June 2013.",
          "url": "https://www.npr.org/sections/thetwo-way/2013/06/07/189531588/night-stalker-richard-ramirez-dies-in-prison"
        }
      ],
      "notes": "The homicide counts are 12 first-degree plus 1 second-degree, totalling 13. Sources that give '13 counts of first-degree murder' are wrong on the composition even where the total is right. The burglary counts matter analytically: this offender was convicted of more burglaries than homicides, and the offence structure was residential intrusion first."
    },
    "confirmed_victim_count": {
      "value": 13,
      "confidence": "established",
      "sources": [
        {
          "tier": 1,
          "citation": "People v. Ramirez, 39 Cal. 4th 398, 139 P.3d 64 (Cal. 2006)",
          "url": "https://caselaw.findlaw.com/court/ca-supreme-court/1098993.html"
        },
        {
          "tier": 4,
          "citation": "NPR. \"'Night Stalker' Richard Ramirez Dies In Prison.\" 7 June 2013.",
          "url": "https://www.npr.org/sections/thetwo-way/2013/06/07/189531588/night-stalker-richard-ramirez-dies-in-prison"
        }
      ],
      "notes": "Homicide convictions only. Five surviving victims of attempted murder, and the victims of the sexual and burglary counts, are not included in this figure and are not enumerated here."
    },
    "attributed_victim_count": {
      "value": 1,
      "confidence": "reported",
      "sources": [
        {
          "tier": 4,
          "citation": "CBS News. 'DNA Links \"Night Stalker\" Richard Ramirez to 1984 Killing of 9-Year-Old Mei Leung.' 23 October 2009.",
          "url": "https://www.cbsnews.com/news/dna-links-night-stalker-richard-ramirez-to-1984-killing-of-9-year-old-mei-leung/"
        }
      ],
      "notes": "One further homicide attributed by a named agency and never charged: the San Francisco Police Department announced on 23 October 2009 that a CODIS cold hit linked him to the April 1984 killing of Mei Leung, aged nine, in San Francisco. He was already under sentence of death and no charge followed. The attribution is agency-sourced, which is why it is recorded — but it is 'reported', not 'established': the announcement described a database hit for which a confirmatory sample was still being obtained, and this dataset has not retrieved the confirmation. Later San Francisco reporting is understood to have complicated the picture; see data_quality.contested_points."
    },
    "claimed_victim_count": {
      "value": null,
      "confidence": "unverified",
      "sources": [],
      "search_exhausted": true,
      "notes": "No stable self-reported total has been retrieved. He contested the charges through trial and appeal rather than claiming offences."
    },
    "estimate_provenance": {
      "value": "The homicide count derives from the conviction record; the single additional attribution derives from a police announcement of a database match. No press-synthesised higher figure is recorded.",
      "confidence": "reported",
      "sources": [
        {
          "tier": 1,
          "citation": "People v. Ramirez, 39 Cal. 4th 398, 139 P.3d 64 (Cal. 2006)",
          "url": "https://caselaw.findlaw.com/court/ca-supreme-court/1098993.html"
        }
      ]
    }
  },
  "offence_period": {
    "first_known_offence": {
      "value": "1984-06",
      "confidence": "reported",
      "sources": [
        {
          "tier": 1,
          "citation": "People v. Ramirez, 39 Cal. 4th 398, 139 P.3d 64 (Cal. 2006)",
          "url": "https://caselaw.findlaw.com/court/ca-supreme-court/1098993.html"
        }
      ],
      "notes": "The killing of Jennie Vincow, the offence whose crime scene produced the fingerprint evidence that later identified him. Note that the SFPD attribution places an uncharged homicide two months earlier, in April 1984."
    },
    "last_known_offence": {
      "value": "1985-08",